0,Dan Peralta Blázquez,dan-peralta-blazquez,Catador de alimentos y bebidas,Corporis nam in officiis. Ipsum unde eius dolorum vel nostrum.
1,José Manuel Fuster Mateo,jose-manuel-fuster-mateo,Físico,Nemo quo quos reprehenderit.
2,Florinda Azorin Cazorla,florinda-azorin-cazorla,Operador de telar y otras máquinas tejedoras,Eaque magnam minima quasi consequuntur voluptatibus repudiandae.
3,Edelmira Taboada Pou,edelmira-taboada-pou,Ingeniero medioambiental,Aliquam officia debitis deserunt incidunt.
4,Flavio Lloret Arranz,flavio-lloret-arranz,Agricultor,Earum tempore quibusdam laborum molestias. Maiores consectetur minima doloribus.
5,Claudio Solsona-Peral,claudio-solsona-peral,Técnico de radiodifusión y grabación audio visual,Impedit fugiat recusandae nulla quibusdam earum ab provident.
6,Carmina Duque Marí,carmina-duque-mari,Mecánico y reparador de vehículos de motor,Unde rerum illo illo.
7,Mónica Portero-García,monica-portero-garcia,Oficinista general,Explicabo id corrupti laborum dignissimos suscipit.
8,Otilia de Palmer,otilia-de-palmer,Cajero de banco,Repellendus omnis repellendus reprehenderit illo eaque quibusdam iste.
9,Dorotea Villa-Cobo,dorotea-villa-cobo,Pintor y empapelador,Expedita iusto voluptatibus quae corrupti.
10,Iris Vilanova Villalonga,iris-vilanova-villalonga,Capitán decubierta,Maxime eum mollitia nam animi facere.
11,Reina Galvez Seguí,reina-galvez-segui,Albañil,Magnam voluptates illo repudiandae eos ducimus. Quas beatae repellendus modi distinctio exercitationem.
12,Cloe Morera Cabrero,cloe-morera-cabrero,Paisajista,Quas amet laboriosam eligendi laborum est itaque placeat.
13,Juanita García Arias,juanita-garcia-arias,Calderero,Quam sapiente laudantium dolorem sit.
14,Edmundo de Bermejo,edmundo-de-bermejo,Personal de limpieza,Labore alias numquam asperiores maiores.
15,Ignacia Jimenez Corominas,ignacia-jimenez-corominas,Entrevistador de investigaciones de mercados,Incidunt magnam facere sapiente blanditiis voluptatem. Aspernatur libero doloremque consectetur sed perspiciatis veniam.
16,Renata Cuadrado Cerdá,renata-cuadrado-cerda,Recolector de leña,A at doloremque. Natus quam excepturi iure enim.
17,Paulina Navas Anaya,paulina-navas-anaya,Catador de alimentos y bebidas,Qui repudiandae aut cupiditate inventore expedita. Consequatur odit reprehenderit ullam aut voluptate sed optio.
18,José Antonio Calvet Sebastián,jose-antonio-calvet-sebastian,Director de cine,Debitis veritatis quas deserunt impedit enim a. Esse officiis illo.
19,Domitila Tirado Gascón,domitila-tirado-gascon,Geólogo,Numquam quam odit ab maxime placeat excepturi.
20,Pilar Gual Cases,pilar-gual-cases,Actor,Odio porro fugit ipsam.
21,Juan Manuel Pujadas-Posada,juan-manuel-pujadas-posada,Cortador de vidrio,Cum aspernatur mollitia incidunt quis vero.
22,Chus Barranco Caro,chus-barranco-caro,Operador de máquinas de tratamiento de pieles y cueros,Voluptatibus ab impedit quam nisi sunt maiores. Voluptatem molestiae similique omnis.
23,Bienvenida Ainara Carbó Villalonga,bienvenida-ainara-carbo-villalonga,Profesional de enfermería,Impedit earum deserunt deleniti blanditiis.
24,Constanza Carranza Vilar,constanza-carranza-vilar,Bailarín,Amet quos nihil dolorum dolores in. Facilis totam facilis porro soluta.
25,Abril Cañellas-Arrieta,abril-canellas-arrieta,Educador para necesidades especiales,Harum consequuntur doloribus praesentium.
26,Eva María Cisneros Tamayo,eva-maria-cisneros-tamayo,Geólogo,Inventore molestiae ipsam labore nemo.
27,Apolonia Arco Carreño,apolonia-arco-carreno,Profesional de medicina,Quas occaecati esse blanditiis earum harum quibusdam.
28,Delfina Caparrós Iglesias,delfina-caparros-iglesias,Operador de máquinas de procesamiento de texto y mecanógrafos,Quibusdam cum dolores mollitia laudantium ut.
29,Lalo Arnal Gimeno,lalo-arnal-gimeno,Meteorólogo,Blanditiis saepe atque modi quod asperiores illum. Architecto suscipit facere rerum esse nam non.
